{"schemaVersion":"agent-vigil-upgrade-config/v1","component":{"ecosystem":"npm","name":"@modelcontextprotocol/sdk","manifestPath":"package.json","identityField":"name","versionField":"version","capabilityFields":["exports","dependencies","engines"]},"runner":{"engine":"docker","image":"node:22.22.3-bookworm-slim@sha256:e21fc383b50d5347dc7a9f1cae45b8f4e2f0d39f7ade28e4eef7d2934522b752","trials":2,"memoryMiB":256,"cpus":1,"pids":64},"canaryDirectory":"canaries","canaries":[{"id":"mcp-sdk-transport-contract","command":["node","package-contract.mjs","mcp-sdk"],"timeoutSeconds":20}]}
