{"schemaVersion":"agent-vigil-upgrade-config/v1","component":{"ecosystem":"npm","name":"@modelcontextprotocol/server-memory","manifestPath":"package.json","identityField":"name","versionField":"version","capabilityFields":["bin","dependencies"]},"runner":{"engine":"docker","image":"node:22.22.3-bookworm-slim@sha256:e21fc383b50d5347dc7a9f1cae45b8f4e2f0d39f7ade28e4eef7d2934522b752","trials":2,"memoryMiB":256,"cpus":1,"pids":64},"canaryDirectory":"canaries","canaries":[{"id":"memory-resource-contract","command":["node","package-contract.mjs","memory"],"timeoutSeconds":20}]}
